Date;Start Run Timestamp;Parameter Set;Run Number;Run Duration (hh:mm:ss);Total Correct Pieces;Last Improvement Iteration;Sequence Length;Total Move Sequence;Improvement Count;Learned Sequence Reuse Count
2025-03-31;17:43:43;P3;1;00:07:26;16;0;100;B U L L D F D Lb F L B Fb R R Bb F F L D Lb D Fb Bb R D B D Bb Rb Bb F Lb Fb B B D L Bb Lb Bb D F R F Rb Db Fb D Lb Db Db Fb Db F D D L D R Fb Rb F Rb Db R Db R F D Fb Db Rb Lb U D D Ub Lb Db Lb Ub Ub Db Ub Ub L L D L D Lb Lb Rb Bb L B R Bb Lb B;0;15
2025-03-31;17:51:09;P2;2;00:00:00;16;0;86;Lb D Rb Rb Fb R F D Fb Db F Bb Rb Bb Bb R B Lb R Fb Rb L Db B D L D Lb Db Bb Lb Rb U Rb F R Ub R U Rb Ub D F R D Rb Fb R Db Rb D B R L Rb B Rb Bb Lb R Bb Rb Bb Db B D R Lb Db Fb D F L D Db Bb D F Db Bb Fb Bb F Bb D Fb;0;13
2025-03-31;17:51:09;P4;3;00:07:22;16;0;71;U Fb Rb D B B B Fb R R Bb F Rb B R B D Bb Rb L Bb R Lb L F L Fb D Lb R R U F Ub Fb Rb F Rb Rb B Db Bb Bb D B R B D Bb R F D Fb Db Rb D Db Rb Bb Db B D R Rb D L Db R D Lb Db;0;13
2025-03-31;18:05:22;P4;1;00:08:27;15;0;80;Bb Bb Db B D Bb L B R Fb Fb Rb L Rb B B Lb R R Bb Db Rb Db R B Rb Db Fb Db F D R F Fb Db Lb F L F B D L Bb Lb Bb Db F D Fb Db Rb Db R Rb B Db Bb Bb D B R B D Bb Lb Fb Db F D Lb Lb Lb Rb Bb Lb B R Bb L B;0;13
2025-03-31;18:13:49;P4;2;00:08:34;15;0;80;U R Fb Lb Fb Db F Db L F Bb L L B Fb L B Lb Db Bb Db B Fb B R F Bb F Rb Db Fb Db F R D R B R Bb Db Rb D D Bb L B Lb B D Bb Bb D B Rb B R Bb Lb Db L Fb Lb D L F R F D Fb Db Rb Db Bb Lb Fb L B Lb F L;0;14
2025-03-31;18:22:24;P4;3;00:08:36;16;0;93;Ub Lb Lb Bb L Db Fb R F Bb Rb Bb R U R Ub Db R D Rb Lb B D Bb L D Lb F R F Rb Ub R R R U Fb Lb Fb L D F Lb Bb Lb B D L Lb D L Bb L B Lb Db Rb Db Rb Rb Db R R Db Db R Db Bb D B D Rb Bb Db B D R Db Lb Fb Db F D L Db F L B Lb Fb L Bb Lb;0;16
2025-03-31;18:31:00;P1;4;00:00:00;17;0;74;R L Bb Bb Ub F U B L D Lb Bb Db B D Bb Db B R Bb Db Rb Db R B Rb Db Fb Db F D R F Rb Fb Rb F D R Lb F L Fb L D Lb Lb Bb Lb F L Fb B L Fb Rb Db Fb R R F R D F Db Db L B Rb Bb Lb B R Bb;0;13
2025-03-31;18:31:00;P2;5;00:01:28;7;0;30;U D Rb Fb Fb Lb Ub R U L Db F D Fb Db Lb D D D L D F L Fb Lb Fb Db F Db L;0;7
2025-03-31;18:32:28;P3;6;00:00:00;17;0;76;Bb D L Rb Rb Rb B U Bb R Bb F Lb Fb B R Lb F L Rb Fb B R F Bb Fb Lb Fb L Db F Rb Fb Fb R F Db F R B L B Lb Db Bb Bb Rb Bb L B Lb R B Lb F L Fb L D L L L Fb Rb Db R D F Rb B R Fb Rb Bb R F;0;14
2025-03-31;18:32:28;P4;7;00:08:40;16;0;112;Bb F Lb Fb B R R Bb Rb L Bb Lb R Bb F L Fb B F D Fb Db Lb Fb L Bb Rb Db R B B D R Db Bb R B R Bb Db Rb Rb Lb B B Lb Lb B B L R Db Db Lb D L D B Db Bb Db Rb Db Rb Rb Db R R Db Db R Db Bb D B D Rb Bb Db B D R Lb Db Db L D Lb D L Db Db B Rb Lb R Lb Lb Rb Lb Bb L Bb L Bb R B Rb Lb R B Lb;0;15
